{
  "input_version": 1,
  "invocation": {
    "caller": "user",
    "harness": "claude-code",
    "mode": "direct",
    "session_id": "session-0001"
  },
  "run_dir": "/tmp/ship-v2/run-0001",
  "run_id": "run-0001",
  "station": {
    "extra_laps": {
      "count": 1,
      "words": "one more lap if it is still open"
    },
    "minor_fixes": {
      "words": "fix the MINORs too"
    },
    "slice": "A"
  },
  "workspace": "/tmp/widget-workspace"
}
