{
  "input_version": 1,
  "invocation": {
    "caller": "user",
    "harness": "claude-code",
    "mode": "direct",
    "session_id": "session-0001"
  },
  "run_dir": "/tmp/ship-v2/run-0001",
  "run_id": "run-0001",
  "station": {
    "signoff_depth": {
      "depth": "DEEP",
      "words": "run the signoff deep, this slice moves money"
    },
    "slice": "A"
  },
  "workspace": "/tmp/widget-workspace"
}
