{
  "input_version": 1,
  "invocation": {
    "caller": "user",
    "harness": "claude-code",
    "mode": "direct",
    "session_id": "session-0001"
  },
  "report_only": true,
  "run_dir": "/tmp/ship-v2/run-0001",
  "run_id": "run-0001",
  "station": {
    "slice": "A"
  },
  "workspace": "/tmp/widget-workspace"
}
